{
  "version": 1,
  "note": "Explicit synthetic local runtime test configuration; never production seed.",
  "stages": [
    {
      "stage": "transcode",
      "coachLabel": "Upload",
      "workerId": "transcode.ffmpeg@1",
      "workerType": "tool",
      "provider": "local",
      "model": null,
      "fanOut": "none",
      "timeoutMs": 300000,
      "retry": 0,
      "fallbackWorker": null,
      "candidates": [],
      "enabled": true,
      "critic": null
    },
    {
      "stage": "transcribe",
      "coachLabel": "Hear your remarks",
      "workerId": "transcribe.synthetic-test@1",
      "workerType": "model",
      "provider": "fake",
      "model": null,
      "fanOut": "none",
      "timeoutMs": 120000,
      "retry": 0,
      "fallbackWorker": null,
      "candidates": [],
      "enabled": true,
      "critic": null
    },
    {
      "stage": "plan",
      "coachLabel": "Match remarks to moments",
      "workerId": "plan.synthetic-test@1",
      "workerType": "agent",
      "provider": "fake",
      "model": null,
      "fanOut": "none",
      "timeoutMs": 60000,
      "retry": 0,
      "fallbackWorker": null,
      "candidates": [],
      "enabled": true,
      "critic": null
    },
    {
      "stage": "moment",
      "coachLabel": "Match remarks to moments",
      "workerId": "moment.synthetic-test@1",
      "workerType": "sub_agent",
      "provider": "fake",
      "model": null,
      "fanOut": "per_remark",
      "timeoutMs": 30000,
      "retry": 0,
      "fallbackWorker": null,
      "candidates": [],
      "enabled": true,
      "critic": null
    },
    {
      "stage": "subject",
      "coachLabel": "Match remarks to moments",
      "workerId": "subject.synthetic-test@1",
      "workerType": "sub_agent",
      "provider": "fake",
      "model": null,
      "fanOut": "per_remark",
      "timeoutMs": 30000,
      "retry": 0,
      "fallbackWorker": null,
      "candidates": [],
      "enabled": true,
      "critic": null
    },
    {
      "stage": "track",
      "coachLabel": "Follow your player",
      "workerId": "track.synthetic-test@1",
      "workerType": "tool",
      "provider": "fake",
      "model": null,
      "fanOut": "per_remark",
      "timeoutMs": 180000,
      "retry": 0,
      "fallbackWorker": null,
      "candidates": [],
      "enabled": true,
      "critic": null
    },
    {
      "stage": "place",
      "coachLabel": "Place and check marks",
      "workerId": "place.synthetic-test@1",
      "workerType": "sub_agent",
      "provider": "fake",
      "model": null,
      "fanOut": "per_remark",
      "timeoutMs": 30000,
      "retry": 0,
      "fallbackWorker": null,
      "candidates": [],
      "enabled": true,
      "critic": null
    },
    {
      "stage": "check",
      "coachLabel": "Place and check marks",
      "workerId": "check.rules@1",
      "workerType": "rules",
      "provider": "local",
      "model": null,
      "fanOut": "per_remark",
      "timeoutMs": 20000,
      "retry": 0,
      "fallbackWorker": null,
      "candidates": [],
      "enabled": true,
      "critic": null
    },
    {
      "stage": "render",
      "coachLabel": "Prepare preview",
      "workerId": "render.ffmpeg@1",
      "workerType": "tool",
      "provider": "local",
      "model": null,
      "fanOut": "none",
      "timeoutMs": 300000,
      "retry": 0,
      "fallbackWorker": null,
      "candidates": [],
      "enabled": true,
      "critic": null
    }
  ],
  "coachStages": [
    "Upload",
    "Hear your remarks",
    "Match remarks to moments",
    "Follow your player",
    "Place and check marks",
    "Prepare preview"
  ],
  "params": {
    "personConcept": "person",
    "minPersonConfidence": 0.5,
    "maxMomentMs": 6000,
    "momentLookbackMs": 12000,
    "keyframeFps": 2,
    "trackPadMs": 1000,
    "downsampleFps": null,
    "minMarkCoverage": 0.6,
    "stillsThreshold": 0.5,
    "allowedMarkTypes": [
      "circle",
      "arrow",
      "highlight",
      "label"
    ],
    "maxMarksPerRemark": 3,
    "labelMaxChars": 60,
    "renderModeDefault": "video",
    "otherPersonRemarksInShare": false,
    "anchorReuseMs": 1500,
    "reassocIouMin": 0.3,
    "swapIouMin": 0.1,
    "swapJumpFrac": 0.25,
    "maxSubjectCandidates": 6,
    "subjectModel": "muse-spark-1.3",
    "segmentationModel": "sam-3.1"
  },
  "limits": {
    "jobSamFrameCap": 6000,
    "jobSparkTokenCap": 400000,
    "fanoutConcurrency": 4,
    "dailySpendLimitUsd": 15,
    "sandboxTimeoutCapS": 3600,
    "sandboxIdleTimeoutS": 300,
    "jobMaxAttempts": 3,
    "maxVideoMinutes": 15,
    "jobLeaseS": 60
  }
}
